{
  "schema_version": "1.0.0",
  "revision": 1,
  "experiment_id": "clm-016-cognitive-tiering",
  "title": "CLM-016: tiered model routing versus uniform judgment routing",
  "description": "Compares a tiered execution profile (economy, standard and judgment routes) against a profile that sends every tier to the judgment route. Model ids in the profiles are placeholders.",
  "hypothesis": {
    "claim_id": "CLM-016",
    "statement": "Reasoning budget, autonomy, and review intensity should be tiered by ambiguity, consequence of error, and checkability rather than maximized uniformly.",
    "treatment_arm": "tiered",
    "control_arm": "uniform-judgment",
    "expected": "treatment-less",
    "falsifier": "A tiered execution profile does not lower provider cost per passed task compared with running every node at the judgment tier, or it lowers the pass rate by more than the run-to-run spread."
  },
  "suite": {
    "path": "suites/rae-smoke-v1/suite.json",
    "digest": "e289144daeaeba8bae5f68ce6fda29393e6f7b11ff9bfe6e1ebe80d8034514dc"
  },
  "arms": [
    {
      "arm_id": "tiered",
      "label": "Tiered routing",
      "description": "Economy, standard and judgment routes. Pricing is a PLACEHOLDER list price in USD per million tokens (input 2.50, cached input 0.25, output 10.00); replace it with the current published prices of the model under study before interpreting estimated_cost.",
      "run": {
        "execution_profile": "profiles/tiered.execution-profile.json",
        "provider": "codex"
      },
      "pricing": {
        "currency": "USD",
        "input_per_million": 2.5,
        "cached_input_per_million": 0.25,
        "output_per_million": 10
      }
    },
    {
      "arm_id": "uniform-judgment",
      "label": "Uniform judgment routing",
      "description": "Every tier uses the judgment route. Pricing is a PLACEHOLDER list price in USD per million tokens (input 2.50, cached input 0.25, output 10.00); replace it with the current published prices of the model under study before interpreting estimated_cost.",
      "run": {
        "execution_profile": "profiles/uniform-judgment.execution-profile.json",
        "provider": "codex"
      },
      "pricing": {
        "currency": "USD",
        "input_per_million": 2.5,
        "cached_input_per_million": 0.25,
        "output_per_million": 10
      }
    }
  ],
  "design": {
    "repetitions": 3,
    "seed": 16,
    "order": "interleaved",
    "paired": true,
    "max_trial_wall_clock_seconds": 5400
  },
  "metrics": {
    "primary": "estimated_cost",
    "secondary": [
      "pass_rate",
      "total_tokens",
      "wall_clock_ms"
    ],
    "pass_at_k": [
      1,
      3
    ]
  },
  "analysis": {
    "alpha": 0.05,
    "bootstrap_samples": 10000,
    "permutation_samples": 10000,
    "correction": "holm"
  }
}
